{"assurance_profile":"full-evidence","freshness":{"age_checked":false,"age_s":null,"allowed_future_skew_s":null,"latest_receipt_iat":1800000020,"max_age_s":null,"one_time_replay_checked":false},"limitations":["offline verification did not query a revocation registry","a receipt revoked after signing may remain cryptographically valid offline","offline verification did not enforce receipt age or one-time replay","valid signatures do not prove receiver correctness, action-set completeness, or non-collusion","grant changes alone do not prove scope containment without the signed grant artifacts","3 of 3 valid anchors use the self-hosted signed log; a self-hosted log is operator-administered evidence and does not establish external anchoring","an anchor verified under a caller-supplied transparency-log key is only as independent as the out-of-band channel that supplied that key"],"redaction":{"enabled":true,"marker":"[REDACTED]"},"result":"verified","revocation_checked":false,"schema_version":"ardur.offline_verification_report.v0.1","source":{"kind":"bundle","sha256":"15bce6f821086d4f4fa63cca00da0e786fbefcc4914631159446a51bf6ee5a63"},"summary":{"anchored_count":3,"authority_narrowing_steps":[1,2],"deny_count":1,"error_count":0,"permit_count":2,"public_log_protocol_anchored_count":0,"receipt_count":3,"receiver_attested_count":2,"unknown_count":0},"timeline":[{"action_class":"read","actor":"spiffe://fixture.ardur.dev/agent/reviewer","authority":{"budget_delta":null,"budget_narrowed":false,"budget_remaining":{"tool_calls":9},"grant_changed":false,"narrowing_proven":false,"why":["no signed budget narrowing at this step"]},"content_class":null,"content_provenance":null,"cost_outcomes":{"cost_usd":0.001,"token_count":100},"decision":"PERMIT","evidence":{"chain_link_valid":true,"receipt_signature_valid":true,"receiver":{"assurance_tier":"receiver-attested","attestation_id":"receiver-attestation:1ad9ce371e0c4cd86879c3c270a96d03c738f5b2ba2138c4d0ed6147894db898","present":true,"receiver_id":"spiffe://fixture.ardur.dev/tool/offline","status":"verified","valid":true},"transparency":{"anchor_class":"self-hosted-log","anchor_id":"anchor:f84c9cab189308c0b112e882a4c8bde6f68e85e7d0d8703658dc90a3cbaca524","backend":"c2sp-local-v1","log_id":"fixture.ardur.dev/offline","log_index":0,"present":true,"tree_size":1,"valid":true}},"evidence_level":"self_signed","grant_id":"grant:offline-verification-fixture","index":0,"instruction_bearing":null,"invocation_digest":{"alg":"sha-256","canonicalization":"jcs-rfc8785","scope":"normalized_input","value":"fEKl2duwjWJuTHsJgL_mIgey4hlgIFUCjjubB26yqcw"},"parent_receipt_hash":null,"policy_outcomes":[{"backend":"native","decision":"Allow","reason":"synthetic permit token=[REDACTED]","rule_id":null}],"reason":"synthetic permit token=[REDACTED]","reason_code":"policy_permit","receipt_id":"receipt:9e1dcb909687aa83fb3d49b12780474f","resource_family":"filesystem","sensitivity":null,"side_effect_class":"none","step_id":"step:offline-fixture:0","target":"https://example.test/items?api_key=[REDACTED]&view=<script>fixture</script>","timestamp":"2027-01-15T08:00:00Z","tool":"read_file","verdict":"compliant","verifier_id":"spiffe://fixture.ardur.dev/verifier"},{"action_class":"write","actor":"spiffe://fixture.ardur.dev/agent/reviewer","authority":{"budget_delta":{"amount":1,"operation":"consume","remaining_after":8,"resource":"tool_calls","unit":"invocations"},"budget_narrowed":true,"budget_remaining":{"tool_calls":8},"grant_changed":false,"narrowing_proven":true,"why":["signed budget delta consume 1","remaining budget decreased in tool_calls"]},"content_class":null,"content_provenance":null,"cost_outcomes":{"cost_usd":0.002,"token_count":200},"decision":"DENY","evidence":{"chain_link_valid":true,"receipt_signature_valid":true,"receiver":{"assurance_tier":"self-attested","attestation_id":null,"present":false,"receiver_id":null,"status":"not-dispatched","valid":false},"transparency":{"anchor_class":"self-hosted-log","anchor_id":"anchor:35e666d43e3a3512e9ad66073f4dae766ed7d2526d264c8dd7af3d8da5ee0951","backend":"c2sp-local-v1","log_id":"fixture.ardur.dev/offline","log_index":1,"present":true,"tree_size":2,"valid":true}},"evidence_level":"self_signed","grant_id":"grant:offline-verification-fixture","index":1,"instruction_bearing":null,"invocation_digest":{"alg":"sha-256","canonicalization":"jcs-rfc8785","scope":"normalized_input","value":"YcWThXnr6Tkc2PoLUe4wGYy9V7S-uScT06PhUnX3zYY"},"parent_receipt_hash":"f84c9cab189308c0b112e882a4c8bde6f68e85e7d0d8703658dc90a3cbaca524","policy_outcomes":[{"backend":"native","decision":"Deny","reason":"synthetic policy denial password=[REDACTED]","rule_id":null}],"reason":"synthetic policy denial password=[REDACTED]","reason_code":"unknown","receipt_id":"receipt:ba9169c5f8c4d80b940d1061acb88db9","resource_family":"filesystem","sensitivity":null,"side_effect_class":"filesystem_write","step_id":"step:offline-fixture:1","target":"workspace/public-fixture-1.txt","timestamp":"2027-01-15T08:00:10Z","tool":"write_file","verdict":"violation","verifier_id":"spiffe://fixture.ardur.dev/verifier"},{"action_class":"read","actor":"spiffe://fixture.ardur.dev/agent/reviewer","authority":{"budget_delta":{"amount":1,"operation":"consume","remaining_after":7,"resource":"tool_calls","unit":"invocations"},"budget_narrowed":true,"budget_remaining":{"tool_calls":7},"grant_changed":false,"narrowing_proven":true,"why":["signed budget delta consume 1","remaining budget decreased in tool_calls"]},"content_class":null,"content_provenance":null,"cost_outcomes":{"cost_usd":0.003,"token_count":300},"decision":"PERMIT","evidence":{"chain_link_valid":true,"receipt_signature_valid":true,"receiver":{"assurance_tier":"receiver-attested","attestation_id":"receiver-attestation:8c2b25622e182fd7bba5871fe62a3f844e581db1952c7051ecd541e2d7c63f40","present":true,"receiver_id":"spiffe://fixture.ardur.dev/tool/offline","status":"verified","valid":true},"transparency":{"anchor_class":"self-hosted-log","anchor_id":"anchor:e24c3d0fc9068cb18e67a3920f48c02c75f0bb718c024f423a130d857bca804c","backend":"c2sp-local-v1","log_id":"fixture.ardur.dev/offline","log_index":2,"present":true,"tree_size":3,"valid":true}},"evidence_level":"self_signed","grant_id":"grant:offline-verification-fixture","index":2,"instruction_bearing":null,"invocation_digest":{"alg":"sha-256","canonicalization":"jcs-rfc8785","scope":"normalized_input","value":"w8R7qg1Kh57SL4_BEnUFbFA71HW6UlmZ4bKIE6vkV2k"},"parent_receipt_hash":"35e666d43e3a3512e9ad66073f4dae766ed7d2526d264c8dd7af3d8da5ee0951","policy_outcomes":[{"backend":"native","decision":"Allow","reason":"synthetic permit token=[REDACTED]","rule_id":null}],"reason":"synthetic permit token=[REDACTED]","reason_code":"policy_permit","receipt_id":"receipt:088260ec1e6eef6a9db38f4acefdf814","resource_family":"filesystem","sensitivity":null,"side_effect_class":"none","step_id":"step:offline-fixture:2","target":"workspace/public-fixture-2.txt","timestamp":"2027-01-15T08:00:20Z","tool":"read_file","verdict":"compliant","verifier_id":"spiffe://fixture.ardur.dev/verifier"}],"trust_roots":[{"role":"receipt-issuer","spki_fingerprint":"sha256:b7b256a140d90424d5561cacf3f66a3f1ebef03c8386f433285cffc1171c4208"},{"role":"transparency-log","spki_fingerprint":"sha256:fe38f45083041a2e2f1d0b3a68a621e0589866fa8d4b8262e0870c8c7b014c53"},{"role":"receiver","spki_fingerprint":"sha256:d6fb4bb87fc1de72ecd9df8121f156cef2024df3510135c175c4f522c4557bde"}],"valid":true,"verification_mode":"offline","verified_at":1783692056}
